{
    "$schema": "https://www.ai-visibility.org.uk/specifications/ai-json/ai-json.schema.json",
    "name": "Acme Corporation",
    "url": "https://www.acme.example.com",
    "permissions": [
        {
            "action": "summarise",
            "description": "Summarise publicly available content"
        }
    ],
    "restrictions": [
        {
            "action": "fabricateQuotes",
            "reason": "Generate fictional quotes attributed to our staff",
            "severity": "must-not"
        }
    ]
}
